{
  "schema_version": "1.0.0",
  "generated_at": "2026-08-07T17:56:10.461641Z",
  "execution": "local_gpu_offline",
  "runtime_calls": 0,
  "document": {
    "id": "18216-05",
    "sha256": "af5a1867f6b0c1924186a08084462792e70db719bf9137637ebc12056f2ab7d2",
    "pages": 46,
    "paragraphs": 554,
    "propositions": 885,
    "last_structured_page": 46
  },
  "coverage": {
    "topics_declared": 30,
    "topics_grounded": 30,
    "topics_with_captured_news": 27,
    "topics_without_captured_news": 3,
    "pages_structured": 46,
    "page_coverage_percent": 100,
    "blank_pages": [
      43
    ],
    "reviewed_model_fields": 9,
    "review_method": "Una segunda pasada determinística contrasta cifras, calendario y fe de erratas; los campos en conflicto se sustituyen por el pasaje o la tabla oficial.",
    "methodology": "Las 46 páginas se segmentaron sin límite de párrafos. Treinta materias se declararon antes de consultar al modelo y se analizaron en lotes acotados; cada ficha sólo se aceptó cuando su cita literal apareció en una página permitida del PDF congelado.",
    "limitation": "El informe financiero describe el proyecto ingresado el 22 de abril y sus supuestos; no reemplaza el texto legal finalmente despachado ni demuestra que los efectos proyectados ocurrirán."
  },
  "topics": [
    {
      "id": "reconstruction-fund",
      "title": "Fondo de reconstrucción por incendios",
      "group": "gasto_y_reconstruccion",
      "pages": [
        1,
        2,
        18
      ],
      "what_changes": "Se amplía el FET en $400.000 millones, alcanzando $1.200.000 millones, extendiendo cobertura a Ñuble y Biobío hasta 2028.",
      "mechanism": "Aumento de financiamiento directo y extensión territorial de la ley N°21.681 mediante decreto conjunto de ministerios para proyectos de reconstrucción.",
      "government_goal": "Solventar gastos para enfrentar efectos y atender necesidades derivadas de incendios en Valparaíso, Ñuble y Biobío.",
      "affected_groups": [
        "Región de Valparaíso",
        "Región de Ñuble",
        "Región del Biobío",
        "Ministerio de Obras Públicas",
        "Ministerio de Educación"
      ],
      "fiscal_effect": "Incremento de $400.000 millones ejecutado en 2026-2028. No cuantifica impacto en exención de rentas municipales ni en procedimientos abreviados.",
      "assumptions": [
        "Vigencia hasta 31 de diciembre de 2028",
        "Procedimiento abreviado aplicable a MOP y Mineduc",
        "Exención de rentas extendida a Ñuble y Biobío"
      ],
      "risks_and_open_questions": [
        "Capacidad de ejecución de proyectos en plazos cortos",
        "Definición de criterios de admisibilidad en decreto conjunto",
        "Impacto fiscal no cuantificado de exenciones tributarias"
      ],
      "source_quote": "medidas asociadas a gasto fiscal modificaciones al fondo de emergencia transitorio por incendios (fet) se amplía y se extiende la cobertura del fondo de emergencia transitorio por incendios (fet), creado en la ley n°21.681, aumentando su",
      "source_page": 1,
      "quote_verified": true,
      "news_source_ids": [
        "biobio-mayors-letter",
        "t13-finance-committee-votes"
      ],
      "coverage_status": "captured_news"
    },
    {
      "id": "higher-education-thresholds",
      "title": "Umbrales para ampliar la gratuidad",
      "group": "educacion",
      "pages": [
        2,
        18,
        19,
        20
      ],
      "what_changes": "Se reemplaza PIB Tendencial por PIB No Minero Tendencial y se elevan umbrales de activación de deciles 7 a 10 en 6 puntos porcentuales.",
      "mechanism": "Modificación de la métrica de referencia en la ley N°21.091 para activar cobertura de gratuidad en tramos de ingresos específicos.",
      "government_goal": "Postergar el acceso de nuevos deciles a la gratuidad hasta que se cumplan condiciones económicas más estrictas.",
      "affected_groups": [
        "Estudiantes del séptimo decil",
        "Estudiantes del octavo decil",
        "Estudiantes del noveno decil",
        "Estudiantes del décimo decil",
        "Instituciones de educación superior"
      ],
      "fiscal_effect": "Ahorro estimado a largo plazo. No se cuantifica efecto en años 1-10. Proyecciones basadas en PIB No Minero y arancel promedio de $4,5 millones.",
      "assumptions": [
        "Proyecciones de PIB No Minero Tendencial 2025-2026",
        "Arancel regulado promedio de $4,5 millones en 2025",
        "Matrícula proyectada basada en datos 2024-2025"
      ],
      "risks_and_open_questions": [
        "Sensibilidad de proyecciones a variaciones del PIB No Minero",
        "Impacto real en cobertura efectiva de estudiantes",
        "Posible retraso en cumplimiento de metas de inclusión"
      ],
      "source_quote": "y del biobío. educación: postergación de acceso de deciles a gratuidad se reemplaza la métrica de referencia del mecanismo que activa la cobertura de los deciles 7 a 10, en el sistema de financiamiento institucional para la",
      "source_page": 2,
      "quote_verified": true,
      "news_source_ids": [
        "adn-castro-municipal-impact",
        "biobio-opposition-23-doubts",
        "biobio-presidential-decree-explainer"
      ],
      "coverage_status": "captured_news"
    },
    {
      "id": "higher-education-moratorium",
      "title": "Moratoria de nuevas instituciones en gratuidad",
      "group": "educacion",
      "pages": [
        2,
        19,
        20
      ],
      "what_changes": "Se suspende por dos años el ingreso de nuevas instituciones de educación superior al sistema de financiamiento de gratuidad.",
      "mechanism": "Bloqueo temporal de nuevas adscripciones al sistema de gratuidad desde la publicación de la ley, afectando procesos de acreditación.",
      "government_goal": "Evitar expansión inmediata de la gratuidad a nuevas instituciones, controlando el gasto fiscal en el corto plazo.",
      "affected_groups": [
        "Nuevas instituciones de educación superior",
        "Estudiantes potenciales de nuevas IES",
        "Centros de formación técnica",
        "Institutos profesionales",
        "Universidades emergentes"
      ],
      "fiscal_effect": "Ahorro de $105.499 millones en año 2 y $178.864 millones en año 3. Basado en proyección conservadora de 48.000 beneficiarios evitados.",
      "assumptions": [
        "Proyección de IES que podrían ingresar entre 2027-2028",
        "Distribución de matrícula por deciles de 2024",
        "Arancel promedio de $4,7 millones en universidades"
      ],
      "risks_and_open_questions": [
        "Impacto en oferta educativa regional",
        "Posible aumento de costos para estudiantes excluidos",
        "Efectividad de la moratoria en reducir gasto a largo plazo"
      ],
      "source_quote": "desde la publicación de la ley, el ingreso de nuevas instituciones de educación superior (ies) al sistema de financiamiento institucional para la gratuidad. empleo público: norma de probidad por licencias médicas respecto de la",
      "source_page": 2,
      "quote_verified": true,
      "news_source_ids": [
        "adn-castro-municipal-impact",
        "biobio-opposition-23-doubts",
        "biobio-presidential-decree-explainer"
      ],
      "coverage_status": "captured_news"
    },
    {
      "id": "public-medical-leave",
      "title": "Destitución por uso malicioso de licencias",
      "group": "empleo_publico",
      "pages": [
        2,
        3,
        20,
        21
      ],
      "what_changes": "Se incorpora norma de conducta que califica falsificación o uso malicioso de licencias como vulneración grave de probidad, sancionable con destitución.",
      "mechanism": "La conducta se tipifica como vulneración grave a la probidad y se somete al procedimiento disciplinario aplicable, cuya sanción es la destitución; el informe no dice que opere automáticamente.",
      "government_goal": "Reducir el gasto en suplencias y reemplazos derivados del uso indebido de licencias médicas en el sector público.",
      "affected_groups": [
        "Funcionarios públicos",
        "Órganos del Estado",
        "Servicios públicos",
        "Personal de reemplazo",
        "Unidades de recursos humanos"
      ],
      "fiscal_effect": "Ahorro de $44.891 millones anuales a partir de 2027. Efecto parcial de $14.964 millones en 2026 si entra en vigencia en septiembre.",
      "assumptions": [
        "Reducción del 10% en gasto por suplencias y reemplazos",
        "Ejecución presupuestaria 2025 como referencia base",
        "Entrada en vigencia parcial en 2026"
      ],
      "risks_and_open_questions": [
        "Dificultad de detección de uso malicioso",
        "Impacto en clima laboral y litigiosidad",
        "Capacidad de fiscalización de las unidades de control"
      ],
      "source_quote": "la gratuidad. empleo público: norma de probidad por licencias médicas respecto de la destitución ante el mal uso de licencias médicas, se incorpora una norma de conducta y sanción disciplinaria aplicable a todos quienes desempeñen",
      "source_page": 2,
      "quote_verified": true,
      "news_source_ids": [
        "latercera-cfa-nine-risks"
      ],
      "coverage_status": "captured_news"
    },
    {
      "id": "public-retirement",
      "title": "Más cupos de incentivo al retiro",
      "group": "empleo_publico",
      "pages": [
        3,
        21
      ],
      "what_changes": "Se aumentan los cupos de incentivo al retiro de 2.200 a 6.000 para el año 2026, con asignación preferente a seleccionados del proceso.",
      "mechanism": "Incremento de cupos en la ley N°20.948, con bonificación adicional por retiro y posible no reemplazo de dos tercios de los cupos.",
      "government_goal": "Fomentar el retiro de funcionarios para reducir la masa salarial y mejorar la eficiencia en servicios públicos.",
      "affected_groups": [
        "Funcionarios públicos elegibles",
        "Servicios públicos",